Category,pk,Name,Brand,Size,Flavor,Servings,Rating,FlavorRating,Reviews,Price,product_description,image_url
WHEY PROTEIN,1,Gold Standard 100% Whey Protein,Optimum Nutrition,2 Lbs.,Banana Cream,29,9.3,8.4,10031,depend on size,Whey Protein with Amino Acids for Muscle Recovery and Growth*,"https://content.optimumnutrition.com/i/on/on-gold-standard-100-whey-protein_Image_01?layer0=$PDP_002$&img404=no-product-image&v=1&locale=en-gb,*"
AMINO ACIDS,2,Glycine 1 Lb. Unflavored,NOW,1 Lb.,N/A,454,8.7,10,3,19.99,Glycine is an amino acid that helps the body build protein,https://s4.thcdn.com//productimg/1600/1600/10530386-1944689571381572.jpg
AMINO ACIDS,3,L-Arginine Powder,NOW,1 Lb.,N/A,98,7.2,4.1,63,24.99,L-Arginine is an amino acid that helps the body build protein,https://s4.thcdn.com//productimg/1600/1600/10529763-6144620646098084.jpg
AMINO ACIDS,4,L-Lysine Powder 1 Lb. Unflavored,NOW,1 Lb.,N/A,822,7.9,10,4,16.99,L-Lysine is an amino acid that helps the body build protein,https://s4.thcdn.com//productimg/1600/1600/10529480-1394695233843472.jpg
AMINO ACIDS,5,L-Methionine 100 Capsules,NOW,100 Capsules,N/A,50,6,N/A,1,9.99,L-Methionine is an amino acid that helps the body build protein,https://www.powerbody.co.uk/media/catalog/product/i/m/image_2017-08-07_59883633280b6.jpg
AMINO ACIDS,6,Qualia Focus 100 Capsules,Neurohacker Collective,100 Capsules,N/A,20,7.6,N/A,0,55.2,Support the brain for better focus,https://cdn1.neurohacker.com/iHxNh2HcedGPXwn5QzNjeodR.png
AMINO ACIDS,7,Beta-Alanine,Allmax Nutrition,100 Grams,N/A,31,8.5,5.8,46,12.74,Super-convenient amino acid to add to your daily shake,https://s4.thcdn.com//productimg/1600/1600/10529809-1214645039707579.jpg
AMINO ACIDS,8,L-Leucine 2000 100 Servings Unflavored,Evlution Nutrition,100 Servings,N/A,100,10,10,6,29.99,Essential amino acid that’s super-simple to add to your daily shake,https://s4.thcdn.com//productimg/1600/1600/10529790-1104620646268115.jpg
AMINO ACIDS,9,Signature Thermogenic 100 Veggie Capsules,Bodybuilding.com Signature,100 Veggie Capsules,N/A,50,7.5,N/A,2,17.49,L-Arginine is an amino acid that helps the body build protein,https://store.bbcomcdn.com/images/store/prodimage/prod_prod4740009/image_prodprod4740009_largeImage_X_450_white.jpg
AMINO ACIDS,10,L-Tryptophan 1000mg/60 Tablets,NOW,1000mg/60 Tablets,N/A,60,9,N/A,2,22.99,L-Tryptophan is an amino acid that helps the body build protein,https://s3.images-iherb.com/now/now00169/w/6.jpg
AMINO ACIDS,11,HMB 1000 Caps 1000mg/90 Capsules,Optimum Nutrition,1000mg/90 Capsules,N/A,90,8.5,N/A,76,37.99,Important amino acid that goes perfectly with protein shakes,https://store.bbcomcdn.com/images/store/skuimage/sku_OPT031/image_skuOPT031_largeImage_X_450_white.jpg
AMINO ACIDS,12,L-Tyrosine Powder 113 Grams Unflavored,NOW,113 Grams,N/A,282,7.4,6.1,13,14.99,L-Tyrosine is an amino acid that helps the body build protein,https://s4.thcdn.com///productimg/1600/1600/10530186-1714797381623403.jpg
PROTEIN BARS,13,Big 100 9 Bars Chocolate Chip Cookie Dough,MET-Rx,9 Bars,Chocolate Chip Cookie Dough,9,8,5.7,47,30.99,"Met-RX Protein Plus is a great tasting high-protein bar with low net carbs, perfect for someone trying to gain or maintain lean body mass. ",https://store.bbcomcdn.com/images/store/skuimage/sku_METR3270025/image_skuMETR3270025_largeImage_X_450_white.jpg
PROTEIN DRINK,14,Pure Pro Shake 12 Bottles Cookies & Cream,ABB,12 Bottles,Cookies & Cream,12,9,8.8,19,48.29,Crystal clear 100% whey protein isolate that’s perfect before or after your workout.,https://www.americanbodybuilding.com/us/img/media/products/pure-pro-50-3.png
PROTEIN DRINK,15,Zero Carb 40 Gram 100% Whey Protein Isolate Drink,Isopure,12 Bottles,Alpine Punch,12,9,8.1,93,44.24,Crystal clear 100% whey protein isolate that’s perfect before or after your workout.,https://store.bbcomcdn.com/images/store/skuimage/sku_NB056/image_skuNB056_largeImage_X_450_white.jpg
PROTEIN BARS,16,Protein Crisp Bars,BSN,12 Bars,Caramel Chocolate Crunch,12,9.5,9.7,274,24.99,"The PROTEIN CRISP BAR is a great tasting bar with a unique crisp texture, helping you stay on track with your nutritional goals. Each multi-textural bar has 20 g of protein",https://cdn.muscleandstrength.com/store/media/catalog/product/cache/all/image/700x700/602f0fa2c1f0d1ba5e241f914e856ff9/p/r/protein_crisp_carton_smores_1.jpg
WHEY PROTEIN,17,Pro JYM Protein Powder,JYM Supplement Science,2 Lbs.,Chocolate Cookie Crunch,2,9.2,9,2730,depend on size,"Protein powder blend of premium sources and ingredients for longer lasting growth helping athletes get bigger, stronger, and leaner",https://store.bbcomcdn.com/images/store/skuimage/sku_JYM4910051/image_skuJYM4910051_largeImage_X_450_white.jpg
WHEY PROTEIN ,18,Animal Whey,Animal,2 Lbs.,Chocolate Chocolate Chip,2,9.1,8.9,607,depend on size,,https://sshealthfoods.com/wp-content/uploads/2020/05/Animal-Whey-1.8-kg.jpg
